Id,Title,Slug,Content,AuthorId,Status,Created,Modified,IsPublic
1,"Lorem ipsum dolor sit amet, consectetur adipiscing elit. Phasellus eu rutrum justo.",lorem-ipsum-dolor-sit-amet-consectetur-adipiscing-elit,"Lorem ipsum dolor sit amet, consectetur adipiscing elit. Phasellus eu rutrum justo. Aenean luctus porttitor dictum. In hac habitasse platea dictumst. Fusce laoreet, est nec tincidunt congue, ligula sem aliquam risus, at faucibus ligula orci at risus. Nunc id sapien at purus pretium condimentum. Fusce risus risus, aliquet vel dignissim a, rutrum id ex. Duis porttitor, tortor sit amet imperdiet ultrices, nibh sapien cursus mi, at venenatis lorem est ultrices orci. Pellentesque et mauris interdum, efficitur arcu nec, euismod lorem. Praesent tincidunt ex nec ligula vehicula ultricies. Proin mattis nibh non elit ultricies cursus. Donec non ex malesuada, dapibus turpis vel, porta est.",1,1,2018-11-23 13:08:00,,True
2,"Curabitur tincidunt, ex aliquam lacinia malesuada, dolor magna eleifend purus",curabitur-tincidunt-ex-aliquam-lacinia-malesuada-dolor-magna-eleifend-purus,"Curabitur tincidunt, ex aliquam lacinia malesuada, dolor magna eleifend purus, ac ornare arcu sapien vitae leo. Nunc quam quam, egestas eu velit a, egestas egestas sem. Suspendisse in accumsan sapien, at interdum mauris. Etiam eget gravida risus. Aenean nulla magna, imperdiet ut mi ut, aliquam tincidunt ligula. Morbi et dapibus purus. Curabitur ullamcorper lacus tellus, eu convallis augue tristique sit amet. Mauris turpis urna, sagittis quis libero id, iaculis porta quam. Phasellus mattis laoreet mi, at ultricies nulla sollicitudin id. Nunc mattis risus in dapibus rutrum. Nunc leo risus, condimentum at convallis a, congue ac nibh. Maecenas nec leo sagittis, varius nisi sed, auctor odio. In condimentum tellus eu tellus venenatis semper. Cras eleifend, ipsum id aliquam euismod, tellus nunc mollis nunc, sed consequat massa odio at odio. Nulla facilisi. Nam in interdum augue. Maecenas quis mollis lorem.",1,1,2019-03-05 13:34:00,,True
3,"Donec laoreet tincidunt urna nec sagittis. Duis vitae sagittis augue",donec-laoreet-tincidunt-urna-nec-sagittis-duis-vitae-sagittis-augue,"Donec laoreet tincidunt urna nec sagittis. Duis vitae sagittis augue. Aenean egestas non nisi nec congue. Nam in elit urna. Fusce et viverra ante. Morbi tincidunt, velit a vestibulum consequat, libero justo tristique augue, quis ornare nisl diam nec est. Ut ornare convallis ipsum, ut posuere nibh fermentum vel. Interdum et malesuada fames ac ante ipsum primis in faucibus. Suspendisse augue elit, pharetra eu ornare vitae, aliquam id arcu. Suspendisse potenti. In sit amet nibh sed velit rutrum sodales. In tempus sem id quam finibus, vulputate egestas ante mollis. Suspendisse nec mauris diam. Nullam euismod viverra condimentum. Suspendisse at magna sit amet ex facilisis viverra eget nec justo. Nulla facilisi. Cras blandit a nunc a dignissim. Duis dictum tincidunt varius. Etiam ultrices facilisis auctor. Suspendisse facilisis ex dui, id finibus massa convallis non. Nulla facilisi.",3,1,2019-03-05 10:12:00,2019-03-05 11:44:00,True
4,Aenean quis aliquam felis. Etiam fringilla vulputate,aenean-quis-aliquam-felis-etiam-fringilla-vulputate,"Aenean quis aliquam felis. Etiam fringilla vulputate mauris, sit amet accumsan lacus suscipit ut. Suspendisse potenti. Integer ac nibh efficitur, interdum urna lacinia, finibus ipsum. Praesent sodales ornare lectus a gravida. Sed consequat vehicula ipsum eu rutrum. Ut nisl diam, lobortis sit amet lacus in, placerat rhoncus justo. Nullam quis feugiat felis. Phasellus nec risus placerat, rhoncus ipsum a, aliquam urna. Vivamus semper tristique nisl quis vulputate. Pellentesque tempus, ex id laoreet lobortis, nunc nisi convallis mi, non iaculis metus odio eu ligula. Morbi ut venenatis mi.",2,1,2019-02-22 17:50:00,,True
5,"Orci varius natoque penatibus et magnis dis parturient montes, nascetur ridiculus mus",orci-varius-natoque-penatibus-et-magnis-dis-parturient-montes-nascetur-ridiculus-mus,"Quisque facilisis sed orci in accumsan. Nulla egestas orci ac justo tempor pharetra. Praesent eget placerat erat, a consequat tellus. Sed interdum enim sit amet metus aliquam, in imperdiet diam congue. Fusce suscipit massa sed pulvinar vulputate. Sed elementum neque in sem ultrices, eget rutrum magna cursus. Vivamus mauris ipsum, semper vitae lectus ac, volutpat vehicula felis. Etiam in est ac ligula posuere lacinia. Phasellus aliquam sapien et neque efficitur, fringilla pretium lorem pharetra. Ut interdum porttitor sapien ut consequat. Sed ac lorem at velit condimentum cursus. Nullam elementum tempus volutpat. Aenean aliquam eros turpis, eu bibendum est consequat sed. Duis maximus nulla et ligula finibus, ac porta ex ultrices. Donec magna quam, fermentum ac pretium et, mollis et lorem. Fusce gravida lacus quis nunc consequat tristique. Nullam eget vehicula odio. Suspendisse vehicula nisl in sodales feugiat. Ut vel mi congue, feugiat dolor non, interdum massa. Integer accumsan posuere bibendum. Quisque sit amet ultricies quam, ac interdum mi. Nullam finibus, lectus eget tincidunt volutpat, arcu magna consectetur odio, id auctor enim est vel justo. Nam accumsan a mi ut auctor. Proin laoreet et leo in ornare. Aenean tincidunt augue id ornare pharetra.",2,1,2019-02-21 14:06:00,,True